{
  "$schema": "https://raw.githubusercontent.com/yehyakin/kin-design-system/main/adoption/kin.evidence.schema.json",
  "kinVersion": "3.0.2",
  "profile": "information-site",
  "productRevision": "unassigned",
  "status": "initialized",
  "reviewedOn": null,
  "mappings": {
    "tokens": {
      "status": "pending",
      "items": [
        {
          "kin": "semantic Tokens",
          "local": "src/styles/tokens.css",
          "notes": "Review local brand and semantic mappings before implementation."
        }
      ],
      "notes": "No Token mapping has been verified."
    },
    "components": {
      "status": "pending",
      "items": [],
      "notes": "Map existing primitives before creating replacements."
    },
    "routes": {
      "status": "pending",
      "items": [],
      "notes": "Record only routes included in the adoption scope."
    }
  },
  "verification": {
    "automated": [
      { "name": "Lint", "command": "npm run lint", "status": "not-run", "runAt": null, "artifact": "", "notes": "" },
      { "name": "Type check", "command": "npm run typecheck", "status": "not-run", "runAt": null, "artifact": "", "notes": "" },
      { "name": "Tests", "command": "npm test", "status": "not-run", "runAt": null, "artifact": "", "notes": "" },
      { "name": "Build", "command": "npm run build", "status": "not-run", "runAt": null, "artifact": "", "notes": "" }
    ],
    "manual": [
      { "id": "light-dark", "status": "not-run", "environment": "", "reviewedOn": null, "reviewer": "", "findings": [], "notes": "" },
      { "id": "keyboard-focus", "status": "not-run", "environment": "", "reviewedOn": null, "reviewer": "", "findings": [], "notes": "" },
      { "id": "touch-small-screen", "status": "not-run", "environment": "", "reviewedOn": null, "reviewer": "", "findings": [], "notes": "" },
      { "id": "normal-reduced-motion", "status": "not-run", "environment": "", "reviewedOn": null, "reviewer": "", "findings": [], "notes": "" },
      { "id": "browser-zoom-200", "status": "not-run", "environment": "", "reviewedOn": null, "reviewer": "", "findings": [], "notes": "" },
      { "id": "long-content-localization", "status": "not-run", "environment": "", "reviewedOn": null, "reviewer": "", "findings": [], "notes": "" },
      { "id": "rtl", "status": "not-run", "environment": "", "reviewedOn": null, "reviewer": "", "findings": [], "notes": "Record a supported locale or explain why RTL is not applicable." },
      { "id": "forced-colors", "status": "not-run", "environment": "", "reviewedOn": null, "reviewer": "", "findings": [], "notes": "" },
      { "id": "screen-reader", "status": "not-run", "environment": "", "reviewedOn": null, "reviewer": "", "findings": [], "notes": "" }
    ]
  },
  "visualReview": {
    "status": "not-run",
    "profile": "information-site",
    "workflow": "",
    "routes": [],
    "baseline": "",
    "candidate": "",
    "environment": "",
    "reviewer": "",
    "reviewedOn": null,
    "criteria": [
      { "id": "task-first", "status": "not-run", "notes": "" },
      { "id": "dominant-region", "status": "not-run", "notes": "" },
      { "id": "continuous-structure", "status": "not-run", "notes": "" },
      { "id": "density-without-repetition", "status": "not-run", "notes": "" },
      { "id": "semantic-separation", "status": "not-run", "notes": "" },
      { "id": "theme-integrity", "status": "not-run", "notes": "" },
      { "id": "motion-continuity", "status": "not-run", "notes": "" },
      { "id": "responsive-priority", "status": "not-run", "notes": "" },
      { "id": "no-fabricated-data-or-behavior", "status": "not-run", "notes": "" },
      { "id": "context-thread", "status": "not-run", "notes": "" },
      { "id": "receding-chrome", "status": "not-run", "notes": "" },
      { "id": "product-family-silhouette", "status": "not-run", "notes": "" }
    ],
    "findings": [],
    "notes": "Select one representative production workflow; a component gallery or design lab does not qualify."
  },
  "production": {
    "status": "not-observed",
    "observedOn": null,
    "evidence": "",
    "owner": "",
    "rollback": ""
  },
  "ownership": {
    "product": "",
    "design": "",
    "engineering": "",
    "accessibility": ""
  },
  "exceptions": []
}
